page_id,page_name,disclaimer,amount_spent_pen,number_of_ads
101665683225827,José Luna Gálvez - Pepe Luna,Mery Nataly Gonzales Enriquez,3287448,712
101665683225827,José Luna Gálvez - Pepe Luna,Laidy Diana Peceros Espinoza,1004610,181
101816778261420,Piensa.pe,Piensa.pe,885831,444
566970220173238,Podemos Perú,Mery Nataly Gonzales Enriquez,738945,336
643403425797969,Yo apoyo a Pepe Luna,Mery Nataly Gonzales Enriquez,382587,168
106854614088402,Pepe Luna Morales,Mery Nataly Gonzales Enriquez,296113,70
566970220173238,Podemos Perú,Laidy Diana Peceros Espinoza,279291,70
317113615022843,César Acuña,Cesar Acuña Peralta,219627,84
106854614088402,Pepe Luna Morales,Jose Luis Luna Morales,184441,28
317113615022843,César Acuña,Silvia Lourdes Miñano Guevara,134223,68
142062936237878,Goberna,Goberna,118230,1871
106854614088402,Pepe Luna Morales,Laidy Diana Peceros Espinoza,115985,19
643403425797969,Yo apoyo a Pepe Luna,Laidy Diana Peceros Espinoza,101150,20
1470976356522933,Daniel Urresti,Jose Luis Urresti Eguiluz,100144,196
100330785132565,Saca tu cuenta,Saca tu Cuenta,99809,150
1470976356522933,Daniel Urresti,Diana Huancaya Matos,87003,105
101311221694306,Nil Luna,Laidy Diana Peceros Espinoza,74237,23
2271299249773092,Asociación de Contribuyentes del Perú,Asociación de Contribuyentes del Perú,70996,165
233943790279421,Jaime Salomón,Jaime Salomón,56665,93
112755042067857,Instituto Peruano de Economía - IPE,Instituto Peruano de Economía - IPE,56530,86
264223880347121,Lampadia Oficial,LAMPADIA,54269,697
111470355596678,ONPE Oficina Nacional de Procesos Electorales - Perú,Oficina Nacional de Procesos Electorales,51140,40
2263394060603974,SER PRO,SER PRO,48556,61
106968764921490,Progresa Perú,These ads ran without a disclaimer,46463,50
109981635701896,Yonhy Lescano,Alavista Marketing Digital,45840,121
433251497093145,Dina Calle,Ronald Briceño,44983,34
119723768043679,Grupo Verona,Giovanni Domenico Verona Baluarte,42967,491
291182786595,Keiko Sofia Fujimori Higuchi,Fuerza Popular,42533,16
432950953564544,Pancho Massa,Francisco Massa,39634,197
107507580716294,Leslye Lazo,Ivette Paola Mendoza Hurtado,39353,36
1511419165829924,Jose Vega,Angel Vladimir Vega Escudero,38572,150
115014573270088,Aron Espinoza,Ronald Briceño,37820,42
462790453744032,Sutep,Sindicato Unitario de Trabajadores en la Educación del Perú - SUTEP,35616,1909
105203064753110,David Jiménez Heredia,Jefferson Henry Lazo Canto,35434,203
106417418305803,Exíge-te Perú,Exige-te Perú,33370,26
106854614088402,Pepe Luna Morales,Podemos Perú,32066,12
129936434473,George Forsyth,Victoria Nacional,31960,126
103215578466089,Datalimon,Ian Paul Brossard Nuñez,30268,91
232608494179327,Rafael Santos Normand,Miguel Angel Torobeo Tapia,29931,23
109019574560600,Aula Gaceta,Ximena Lizbeth Paz Garcia,29911,16
101665683225827,José Luna Gálvez - Pepe Luna,Jhonatan Alfredo Flores Cuya,29649,4
111756757285776,Laidy Peceros,Laidy Diana Peceros Espinoza,28201,14
103807051866147,Pormifamilia,GO Digital,27107,77
101382064633453,Maricarmen Alva,Maria Del Carmen Alva Prieto,26126,55
103899138320288,Jouliano Seminario,Jouliano Segundo Seminario Porras,25875,100
484861495269792,Edgard Cayotopa - Acción Popular,AUGE GROUP CORPORATION SAC,25284,14
495706950531442,Pepe Feria,Jose Praxedes Feria Madrid,24349,72
257921784254554,UNICEF Perú,These ads ran without a disclaimer,24301,52
507219639352019,Botica Magistral Firstmed Pharma,These ads ran without a disclaimer,24081,2
1909864829076011,Prensa AntiCorrupción,Prensa Anticorrupción Latam,23555,14
319686004790789,Maestrías ESAN,Grupo P - INDEX,22350,114
347092853043893,Perú Libre - Pedro Castillo,Oficina Nacional de Procesos Electorales,21575,7
47446118027,Ollanta Humala Tasso,Lady Johanna Bermudez Lopez,21555,64
251694484848356,Progresista de Apurímac,Progresista de Apurímac,21502,322
793399240790250,Antony Pinedo,Antony Pinedo,20985,87
610541935945465,FH PERU,FH Perú,20954,232
109614831277046,Unidos por un Perú mejor,Unidos por un Perú Mejor,20570,46
114450806989403,El Importador,Guido Vicente Bellido Huarcaya,20124,41
121135514583662,World Vision Perú,World Vision Perú,20013,42
729149373915986,Rextie,Rextie,19688,222
657005737775582,Heidy Juárez Calle,Heidy Juárez Calle,19100,85
169154336444354,Pancho Diez-Canseco,Pancho Diez Canseco,18931,52
101665683225827,José Luna Gálvez - Pepe Luna,These ads ran without a disclaimer,18573,6
167878593236712,UNICEF en español,UNICEF con créditos publicitarios de Facebook,18543,4
120608763182000,José Henrry Flores Díaz,José Henrry Flores Díaz,18442,43
105776167573398,Gestión Pública & Control,Alison Nataly Canales Rodriguez,18407,14
107378318175855,Votopormipaís,Ana Cecilia Anton Borjas,17721,31
116937091779490,Jóvenes Fuerza Popular Keiko,Fuerza Popular,17210,5
109101387687973,Piensa Música,Richard Cornejo Torres,17024,3
108008647768570,Luis Hurtado Valencia,Victor Antonio Calderon Leyva,16921,74
362634630565676,Soy Eduardo Caprile,Eduardo Caprile Saint-Pere,16603,46
133644486670469,JustoMedio,Marco Antonio Arrunategui Cevallos,16575,30
103105511704815,Freddy Aréstegui Saavedra,FREDDY AURELIO ARESTEGUI SAAVEDRA,16313,91
111742210321219,Julio Sal y Rosas Guerrero,Julio Ignacio Sal Y Rosas Guerrero,16276,116
103332505036849,Deborah Inga Zapata,Deborah Carmen Inga Zapata,15983,28
108143704453362,Shadia al Congreso,Shadia Elizabeth Valdez Tejada,15910,42
1533235346996708,Wilmer Valverde,Marcareando,15683,77
351653851127,Nano Guerra,Nano Guerra,15289,15
687691121319854,Ernesto Álvarez Miranda,Ernesto Julio Alvarez Miranda,15160,157
102888608247795,Alejandro Cavero,Gabriel Jochamowitz Schwartzmann,15032,186
109789794548552,Juan Matzumura,Frank Antonio Flores Quiñonez,14973,69
100386664728880,Ernesto Zunini,AUGE GROUPCORPORATION SAC,14900,10
1629211737145398,Dr. José Carlos Ordoñez,Dr Jose Carlos Ordoñez,14538,215
362423643572,Alberto Beingolea,Partido Popular Cristiano,14536,50
140765589379192,Pedro Spadaro,Yo apoyo a Pedro Spadaro,14281,80
103770648368639,Konnie Vidaurre,Konnie Vidaurre,14203,67
1470976356522933,Daniel Urresti,Julio Garces Calle,13817,72
102673481661276,Jorge Seminario,Jorge Eduardo Seminario Salazar,13711,45
111816763739659,Digital TV Noticias,Miguel Angel Torobeo Tapia,13711,10
317875174912143,Presidencia del Consejo de Ministros del Perú,These ads ran without a disclaimer,13348,7
1511419165829924,Jose Vega,These ads ran without a disclaimer,13252,22
297909224081530,Despierta Perú,Noticias | Perú Digital,13187,6
110695024106209,Juventud Podemos Perú,Laidy Diana Peceros Espinoza,13119,5
143175009597452,Iván Hernández,Iván Segundino Hernández Carrasco,13046,137
678043585730804,"Ceprebanko - Certificación ""Cajero Bancario y Comercial""",These ads ran without a disclaimer,12924,13
482342095243763,Lucho Molina - Lima,Daniel Salas,12779,67
721209661258478,Felipe Castillo,Luis Felipe Castillo Oliva,12614,150
121759302958701,René Chávez - El Médico del Pueblo,Somos Perú Loreto,12475,82
113162141028968,Integridad,Integridad por el Peru,12013,140
404055736443363,Julián Palacín,Julian Palacin Gutierrez,11664,85
111080984768518,Oscar León,Diana Huancaya Matos,11613,63
808315139283273,Roberto Sánchez,Omar Rubio Santander,11600,23
453889284779859,Tony Angulo,David Dávalos,11598,62
100649128244355,Miguel Pérez-Política y Social,Julissa Victoria Ricopa Pacaya,11493,59
1430609120516628,Gorbak Infantes,Wendy Cesarela Ruiz Rodriguez,11491,49
1538852096428300,Maritza Gil,MARITZA GIL,11408,323
325409054278267,Manolo Praeli,Carlos Manuel Edmundo Praeli Rojas,10957,421
101311221694306,Nil Luna,Luis Felipe Alejandro Luna Morales,10750,6
501738560237334,San Juan de Lurigancho Sin Corrupción,Juntas Vecinales de San Juan de Lurigancho,10488,6
21325533991,Inversor Global,These ads ran without a disclaimer,10484,14
1694440714197793,Pepe Gálvez el Oso,Pepe Galvéz el Oso,10325,167
107202871320408,Jorge Chávez Alvarez,Victoria Nacional,10286,23
162880980862726,Red Hat,These ads ran without a disclaimer,10254,2
319749898114045,Jackpot Party Casino Community,These ads ran without a disclaimer,10112,3
108198570574884,Gustavo Cesti Cardó,Gustavo Guillermo Cesti Cardó,10033,57
964277866947393,Diego Bazán Calderón,Renovación Popular,10028,52
699489483476556,Darwin Espinoza Vargas,Jhaec Darwin Espinoza Vargas,10005,100
531332587225016,Podemos Perú - Piura,Jhonatan Alfredo Flores Cuya,9848,3
103029921716893,Juan Valverde,Juan Carlos Valverde Geldres,9642,191
102138138335502,Pepe Pozo al Congreso,Jose Manuel Pozo García,9607,32
104883417709021,Robinson Gupioc,Laidy Diana Peceros Espinoza,9552,2
109192677992923,Elige tu Lucha,Antonio Javier Bisbal Caceres,9551,242
1193751930654464,Romelia Paredes,Romelia Paredes,9542,19
104628238147151,Sergio Vasquez Coronado,Segundo Sergio Vasquez Coronado,9525,34
101892898786829,Despierta Perú,These ads ran without a disclaimer,9485,1
1607614952838589,Mary Acuña al Congreso,Mary Acuña Peralta,9484,11
34839376970,Infobae,These ads ran without a disclaimer,9431,16
242212052635794,Fernando Meléndez,Andy Valdir Enciso Gonzales,9319,67
196175927619103,Perú sin Censura,Destapes Perú,9205,5
100198778518392,Mg. Luis Gallardo Gálvez,Mery Nataly Gonzales Enriquez,9024,12
102016708354878,Jeri Ramon Ruffner,Siempre San Marcos,8999,57
2155897354682813,Justicia sin corrupción,Prensa Anticorrupción Latam,8929,3
116832580445194,PerúCheck,PERUCHECK,8855,8
214114562821852,Noizz App,These ads ran without a disclaimer,8780,5
161170137278613,Banco de Crédito BCP,These ads ran without a disclaimer,8737,2
100667365286868,Asceli Rabasa 10,Jose Luis Rios Monterrey,8712,37
478791792232903,Daniel Malpartida,Avanza País Callao,8631,26
1413556535603177,Raúl Díaz Pérez,Raul Diaz Perez,8511,104
1573884479501568,Frank Krklec,Frank Krklec Torres,8494,4
149345658977441,Quinto Poder,Ulises Gallegos Ormeño,8451,80
192928358020129,Carlos Calderon - Alcalde de Trujillo,Joaquín Calderón Alarcón,8429,67
109735297111847,Noticias Perú Digital,Juntas Vecinales de San Juan de Lurigancho,8274,5
106180834755385,Donald Torrico Mostajo,Donald Harold Torrico Mostajo,8217,78
103218915010607,elprofearanda18,Karen Rosita Roman Carrasco,8129,19
117001009126,PROMSEX,PROMSEX,8084,85
2123223541294131,APP Región La Libertad,APP Región La Libertad,8036,130
1392040064393275,RUBÉN CANO,Ruben Cano,8033,69
173144229408518,RENIECPERU,Registro Nacional de Identificación y Estado Civil,7998,9
165837734193099,Pedro Morales Miranda,Acción Popular,7911,36
319226058479847,El Gallo Gronerth,Roger Gronerth,7794,101
461756940672455,Ashanti Perú - Red Peruana de Jóvenes Afrodescendientes,Marco Ramírez,7723,34
102344912019605,El Mayor Riesgo es,Jaime Jose Eduardo Freundt Lopez,7695,223
2243526259054575,Marie Ayasta,Marie Ayasta,7599,63
887873504612353,R&G Indumentaria de Higiene y Seguridad,R&G Seguridad e Higiene Industrial SAC,7478,29
1950868351861257,Leo Huayama,Stockily,7477,34
124560987619120,Imasolu: Estudios de mercado y Marketing,Enzo Vittorio Elguera Echegaray,7458,43
279474542534783,Goyo Quispe,Gregorio Bernardino Quispe Alvino,7108,77
776581735709971,Eduardo Saenz Construyendo,Eduardo Armando Saenz Faez,7085,18
112315540399875,Propuesta Paco Gavidia,Propuesta Paco Gavidia,7047,120
746974488735711,Charles Zapata,Charles Adrian Zapata Vega,7018,103
506111559721201,Mirelo Loreto,Enrique Jose Vilca Salazar,6992,20
424028077806278,KAS Perú,Konrad-Adenauer-Stiftung e.V.,6865,24
1484332041689680,Roche Perú,Michael Axel Morris Martinez,6848,84
101816778261420,Piensa.pe,These ads ran without a disclaimer,6838,31
133074956714225,Jurado Nacional de Elecciones del Perú,Jurado Nacional de Elecciones,6744,12
105835907510633,Patty Chirinos,Patty Chirinos,6729,16
101720841658652,Medaly Huaman al Congreso por Ica,Loreny Medaly Huaman Huayta,6563,37
366120717468467,Bancada Podemos Perú,Mery Nataly Gonzales Enriquez,6520,1
253615198009828,Anglo American,These ads ran without a disclaimer,6496,3
191569760893836,Chirapaq,Chirapaq Centro de Culturas Indígenas del Perú,6480,18
107912051341245,Valera Morillo,Jheslyn Misshell Valera Morillo,6234,44
236240533617906,Partido Devolucion,Partido Devolucion,6155,64
102098544497318,Alfredo Perez Alcalde 2023,Omar Alexander Lopez Vilchez,6149,30
169741473678417,Nico Talavera,Nicolas Andres Talavera Benavente,6145,146
242483566108002,Whetu,These ads ran without a disclaimer,6106,73
104402974872962,Adriana Tudela al Congreso 2021,Franco Alberto Arfinengo Oliva,6053,62
794646070880649,Dr. Vera - Surco,David Ignacio Vera Trujillo,6039,35
274611865891177,Verónika Mendoza,Verónika Mendoza,6034,8
107674917831466,Ana Cecilia Garzon,Ana Cecilia Garzón Pérez,6016,19
58895017663,Banco Interamericano de Desarrollo,These ads ran without a disclaimer,5987,37
104938247754336,Clara BCP,These ads ran without a disclaimer,5945,12
112652230539548,Preston Melamina,These ads ran without a disclaimer,5940,2
112992267268835,"Cambió Trujillo, Cambiará el Perú - CAP Presidente","Colectivo CAP - Cambió Trujillo, Cambiará el Perú",5900,31
100372761998126,Enver Flores Ojeda,Enver Flores Ojeda 2021,5878,61
1648539058728237,Gerardo Saavedra,Jean Pierre Mori Perez,5814,42
956663201099385,"Jorge Meléndez Celis, Gobernador Regional de Loreto.",Jorge Enrique Meléndez Celis,5784,89
110542577757410,Vota y Vota Bien,"PERSONA, VIDA Y FAMILIA",5737,16
109091011430956,Ultra Fighter: Supernova,These ads ran without a disclaimer,5725,14
114869120240314,Pepe Pajuelo Oliveri,Pepe Ernesto Pajuelo Oliveri,5591,16
319944412781748,Efrey Becerra JP3,Adan Efrey Becerra Garay,5533,39
114155063557959,Jean Pierre Combe Portocarrero,Diana Huancaya Matos,5449,7
397709203763895,Lucho Durán,Lucho Duran,5440,88
103903134990350,Digital TVGO,Josué Ubierna Barandiaran,5254,3
314495422404390,Podemos Perú - Lambayeque,Jhonatan Alfredo Flores Cuya,5197,2
100685622016966,Natalia Taco - Oficial,La Oveja Merino,5189,11
1714025882234497,Iuridicas Escuela,These ads ran without a disclaimer,5169,1
117498400158090,Héctor Acuña,Carolina Asis,5107,80
103548778388958,Gabriela Coaguila,Gustvao Martin Medina Sanes,5080,17
181220655403516,Salvador Heresi,Saleh Carlos Salvador Heresi Chicoma,5076,34
107850294470186,Marco Zevallos,Marco Antonio Zevallos Bueno,4990,24
248986568895243,Speechify,These ads ran without a disclaimer,4954,9
104273251982523,Elber Requejo - JP,Requejo Sanchez Elber,4934,44
165365681856956,José Antonio Alvarado,Jonathan Cesar Sanchez Cuya,4916,12
271385249897782,Trujillo 60,n60,4898,189
107204894072263,Ursula Moscoso Martínez,Ursula Pilar Moscoso Martinez,4877,13
106775297428865,Isabel Manrique,Isabel Manrique,4876,60
1593009867670226,Terminantemente Prohibido VOTAR basura,Jose Fernando Espinoza Sinche,4871,35
354279831422895,Washington Capital,These ads ran without a disclaimer,4829,31
1701687773439212,Giancarlo Guido Casassa Sánchez - Alcalde de Surquillo,Giancarlo Guido Casassa Sánchez,4829,161
108063927782769,Raquel Medina,Franck Ray Orosco Valverde,4817,11
89660988793,Asociación Paz y Esperanza,Asociación Paz y Esperanza,4776,87
101645565076595,Enrique Alva,Tracy Mayuri Guillen Montalvan,4750,46
224866162757,Carlos Bruce - Techito,Lu Araujo Canales,4744,59
389976681048925,ECMIA,Enlace Continental de Mujeres Indígenas de las Américas,4725,12
346354539205278,Abel Bolaños - Victoria Nacional Tacna,Margarita Victoria Herrera Bendezu,4725,167
112105850263842,Carlos Anderson,Maria Alejandra Palacios Zavaleta,4701,31
761235197258266,Luiz Carlos Reátegui - Frente Esperanza Jesús María 2022,Luiz Carlos Reátegui del Águila,4675,24
102533848285908,Veronica Escobal Ordóñez,Veronia Rebeca Escobal Orodñez,4662,117
456858074508608,Jheydi Quiroz Palacios,Jheydi Quiroz,4641,37
382057815556578,Chino Martínez,Chino Martinez - Parcona,4598,34
101876155342702,Asociaciones de Marketing y Publicidad,These ads ran without a disclaimer,4566,1
110736538245244,Joaquín Alcalde De Cajamarca,Jesus Moya Cerquin,4532,15
103632004923753,Leo Salluca,Leo Salluca,4520,40
524687577593259,Alejandro Narváez Liceras,Juan Carlos Tarazona Cabello,4519,26
107507580716294,Leslye Lazo,These ads ran without a disclaimer,4517,4
100356711460057,Richar Bacon,Richar Eli Bacon Terrones,4509,28
925099280862495,Joel Parimango,Joel Ronal Parimango Alvarez,4508,63
100265355096831,Imperio: Rising Civilization,These ads ran without a disclaimer,4497,13
103871541689984,Edilberto Salazar Arequipa,Jhon Jheiman Torres Cahua,4491,28
108231127791397,Edson Flores,Edson Ramon Flores Castillo,4480,31
100257651988705,MediFast L&M,MediFastL&M,4477,159
1413556535603177,Raúl Díaz Pérez,Raúl Diaz Pérez,4461,61
1433417963605140,"Fabiola Morales Castillo, NARRA Y OPINA",Fabiola Morales Honestidad,4442,8
233943790279421,Jaime Salomón,Jaime Salomon,4425,37
100567791707545,Dr Omar Cuadros,Omar Tito Cuadros Iparraguirre,4393,37
59764099683,ESAN Graduate School of Business,Grupo P - INDEX,4307,34
104646350985692,Peter Jaime,Peter Omar Jaime Cori,4295,40
197915158409,Amnistía Internacional Perú,These ads ran without a disclaimer,4231,2
1165330606976450,Eduardo Azabache,Mauricio Renato Huaman Huaman,4227,58
1650216218535063,Oceana Perú,Oceana Perú,4225,71
433251497093145,Dina Calle,Sheila Llanos Veliz,4178,7
104889224894359,Katherine Ampuero,Katherine Ampuero,4167,16
106854614088402,Pepe Luna Morales,Jhonatan Alfredo Flores Cuya,4161,1
1691960551107938,Dra Arcelia Rojas Salazar,Dra Arcelia Rojas,4159,23
501281283413954,Andrés Alcántara Paredes,Ronaldo Jeanpierr Oyola Gomez,4151,70
1850708491662790,Jose Ignacio Beteta,Jose Ignacio Beteta,4137,50
109019574560600,Aula Gaceta,Gaceta Jurídica S.A.,4111,4
1643625532431014,KAROL Paredes,Pamela Isuiza Lopez,4100,67
104118211629500,Varinia Moreno Córdova,Varinia Marlene Moreno Cordova,4044,49
1600213560208605,Municipalidad Provincial de Huánuco,Luis Mijail Ursula Carrillo,4038,80
106846268009745,Margarita Rodriguez,Margarita Elena Rodriguez Alfaro,4033,16
1413556535603177,Raúl Díaz Pérez,Italo José Quispe Lévano,4000,2
110030884769294,"Maestro mayor Catemaco ""El Jaguar Negro""",These ads ran without a disclaimer,4000,4
102507351695892,Ing. Angel López Panduro,Angel Augusto Lopez Panduro,3983,54
107865304679322,Los Amigos de Yonhy Lescano,Julissa Fanny Begazo Guevara,3982,32
102585367941782,Rafael López Aliaga,Renzo Cossio,3943,6
103568711737392,Carlos Chumpitaz,Carlos Eduardo Chumpitaz Camacho,3943,41
102398671887651,Martin Teixeira,Martin Amado Rivas Teixeira,3934,53
101533301762915,Teresa Solano - Junín,Teresita de Jesús Solano Corzo,3930,62
216284595086378,Dakar Tattoo,Orlando Thyr Cabrejos Espinal,3913,38
109669331422877,Carlos Gonzales,Nelida Susy Montenegro Mess,3908,61
243790482299542,Grupo AUGE Capacitación Docente,Ronald Avellaneda Montenegro,3881,1
2115747855314930,Guillermo Aliaga,Guillermo Aliaga,3877,72
102098544497318,Alfredo Perez Alcalde 2023,These ads ran without a disclaimer,3871,33
1613265342081943,Julio Martinez Garcia,Julio Eden Martínez Garcia,3859,59
544732736023645,Consejo Privado Anticorrupción - CPA,Consejo Privado Anticorrupción - CPA Perú,3824,137
116376803134045,Rosangella Barbarán,Rosangella Andrea Barbaran Reyes,3814,19
47446118027,Ollanta Humala Tasso,Blanca Rosales Valencia,3805,10
996199500463446,Rosa Bautista Al Congreso,Mery Nataly Gonzales Enriquez,3780,6
137727683515281,Cristofer Barrionuevo,Cristofer Ronal Barrionuevo Romero,3767,74
719853864726295,Mindvalley,These ads ran without a disclaimer,3743,64
111946828036314,Lucio Deza,Silvia Cecilia Zambrano Esquivel,3721,22
101446731993982,Luis Ángel al Congreso 2021,Diego Hugo Lombardero Lamas,3714,22
123983311020012,Lalo Albarracin,Eduardo Danilo Albarracin Ugarte,3696,45
114696193780931,Manolo Garcia Correa,Jordan Robledo Rojas,3693,24
2214007778856477,Judith Laura - Oficial,judith Laura,3678,45
101221585304943,Manuel Ato,Manuel Antonio Ato Del Avellanal Carrera,3668,3
105099615091317,Perú La Única Opción,These ads ran without a disclaimer,3652,47
105819178511926,Tú eres Gaia,These ads ran without a disclaimer,3638,12
100292211941140,Andres Sotil 19,Vicente Cuaresma Escudero,3627,9
113857973395461,Luis Angel Aragón - Congresista de la República,Diego Alonzo Alvarez Guevara,3580,79
103775971899564,Asociación Emprendedores Jóvenes del Perú,These ads ran without a disclaimer,3575,11
248491675809603,Zenaida Solís,Erick Vega Agreda,3567,29
101546698904987,Carlos Paipay Quispe,Kassandra Nahomi Rivera Naquiche,3528,14
352924605796286,Héctor Espinoza,Nicolas Puma,3517,28
105073931468070,Jorge Del Castillo Pretell,Jonathan Salazar Aguilar,3509,13
1321713074657834,Jorge Nieto Montesinos,Jorge Nieto Montesinos,3498,21
163612560674668,Mario Quispe,Wilver Quispe Ramos,3493,45
104856948415807,Alerta Perú,These ads ran without a disclaimer,3490,9
393774177491180,Angelica Apolinario,Luz Angelica Apolinario Llanco,3473,30
1210480918975729,ExitoFem,These ads ran without a disclaimer,3445,3
111942100714385,Lucho Sarango Seminario,Luis Alberto Sarango Seminario,3417,85
113716881103703,Juan Carlos Zevallos,Arturo Castilla,3410,32
109721698040967,EnConsulta.pe,GOBIERNA CONSULTORES,3405,17
347630472026862,Jose Gallo,Jose Antonio Gallo Pedemonte,3403,17
101382872505878,Dennis Sánchez,Dennis Sánchez,3402,47
128400214531888,PPP Partido Patriótico del Perú,Herbert Caller Gutierrez,3397,20
996199500463446,Rosa Bautista Al Congreso,Jhonatan Alfredo Flores Cuya,3389,5
621241797959966,Martha Baldeon,Danny Baldeon Remuzgo,3387,38
161024241267665,Julio César Silva Meneses - Abogado,Julio César Silva Meneses,3386,65
108289588086058,Comunismo Jamás,Luis Dianderas Caceres,3374,18
100692322242812,Mag. Juan Carlos Collado Felix,Mag Juan Carlos Collado,3365,93
104774481450085,La Mendoza K12,Leonardo Benjamin Castro Pozo Chavez,3339,65
1671834356419198,Marco Curi,Marco Curi Perales,3326,13
107854269243024,Cámara de Comercio de Lima,These ads ran without a disclaimer,3301,7
101486158619208,La MISKI Al  Congreso,María Jesús Rodríguez Nuñez,3301,49
114428030003661,Alex Flores Ramírez,Alex Randu Flores Ramírez,3279,17
102607718645901,Pepe Luna SJL,Gerald Alberto Mejía Vásquez,3234,3
269977736834906,Juan Enrique Dupuy,MAP,3219,14
346829165513127,Compromiso Médico por el Perú,Cesar Alvaro Rondón Quispe,3215,22
107972128106412,Adelante Perú,Adelante Peru,3203,37
209162673317699,ManoBook,These ads ran without a disclaimer,3192,10
455802295156178,Nuestramerica TV,Peter Deniss Salguero Contreras,3185,123
101141151981362,JC Mercado,Juan Carlos Mercado Torres,3170,138
105566621000561,Juntos en otra victoria,Bruno Eduardo Marin Jiga,3161,12
650993505514084,Jherson Atoche Chunga,Jherson Jose Atoche Chunga,3108,37
100112368695046,Verdad Milanesa,Racso Gerardo Guillermino Miro Quesada,3106,24
104883417709021,Robinson Gupioc,Diana Huancaya Matos,3099,16
100741848690728,Marlon Alarcón,Marlon Kenny Alarcón Azplicueta,3079,5
1789685151346147,Gina Galvez,Aaron Esteban Huaynate Espinoza,3056,17
104528374283784,Manuel del Águila,Manuel Fernando Del Aguila Zuñiga,3049,59
161405827846629,Juan Manuel García,Juan Manuel García,3049,38
497921403555219,FIELD,These ads ran without a disclaimer,3021,3
267352327131230,Podemos Perú - Ica,Jhonatan Alfredo Flores Cuya,3000,1
247968995742693,Podemos Perú - Áncash,Jhonatan Alfredo Flores Cuya,3000,1
1913645298646217,Podemos Perú - Loreto,Jhonatan Alfredo Flores Cuya,3000,1
369208709863495,Marité Bustamante,Marité Bustamante,2972,51
112895666830094,Leonor Chambi Palero,Leonor Avelino Chambi Palero,2965,27
101297472043011,Candidatos Bicentenario Perú,Mylene Carol  Romero Goytendia,2962,25
113163117039969,Dr. Jorge Ayala,Jorge Winder Ayala Gonzalez,2946,55
282226805139684,Janet Cubas,Jorge Atila Arevalo Chilon,2920,8
279850938750187,Politólogos Digitales,Politólogos Digitales,2828,35
110873748930241,Universidad Científica del Sur,These ads ran without a disclaimer,2826,1
106807872031579,Christian A. Zegarra,Progresista de Apurímac,2824,33
518272571603665,Yo También Tengo Algo que Decir,Paz y Esperanza,2814,38
200478833663042,Land Rights Now,These ads ran without a disclaimer,2808,3
105566838477273,Leonor Carolina Romero - Abogada,Julio César Silva Meneses,2795,34
100947848530320,Norith Grandez,Marden Navarro Rengifo,2780,13
153817774632826,Reacciona PIURA,Ricardo Vicente Sancarranco Navarrete,2778,38
106846268009745,Margarita Rodriguez,Lucas Fidencio Rodríguez Tineo,2769,12
105853488326466,ONU Cambio Climático,These ads ran without a disclaimer,2760,2
283647955155472,Sigrid Bazan,Paul Kevin Puelles Cárdenas,2759,19
266879337299982,Jane Cuchilla JP1,Diego Alberto Crispin Paz,2754,29
414139832118173,Ciro Castillo - Callao,Antonio Castillo Rojo Garcia Caballero,2750,18
100199365350176,Rosenith,Rosenith Pinedo Dávila,2738,11
108786050805720,Milton Jiménez Salazar,Milton F. Jimenez Salazar,2730,15
859489764089847,Mariano González,Rosa Elvira Guayanay Flores,2724,41
1072578546139663,Teoría de la unión de los 5 continentes,Josue Balta Portella,2719,13
109810631282054,100% Colectivo Ciudadano,Lucas Fidencio Rodríguez Tineo,2704,3
122364724975135,Livia Flórez - Página Oficial,Livia Esther Flórez Fernandez,2696,5
104015498308517,Edwer Tuesta Hidalgo,AUGE GROUP CORPORATION SAC,2693,3
101907558397704,Edilberto Robles por Ancash,Kelly Karen Cubeños Sanchez,2688,13
108771534158749,Willian Sánchez al Congreso,Daniela Nicole Ledesma Susanibar,2685,22
107177257988205,Jesús Sandoval al Congreso,Jonathan Kenyi Granados Okahara,2678,26
494683000983271,Dr. Marco Ramos,Marco Ramos,2666,29
113121657268838,Mónica Daga,Ramiro Omar Blas Chavez,2638,16
883608538372189,Cidap Perú,José Antonio Mangini Sánchez,2637,30
104495468180626,Gianina Manrique Mansilla,Valeria Jazmin Aponte Jurado,2618,60
343032176932098,Deisy Hurtado - Parlamento Andino,Viictorr Hugo Collantes Fournier,2614,53
332503550172994,Gobierno Regional de Apurímac,Miguel Angel Lagos Fuentes,2607,16
